{
  "schemaVersion": 1,
  "workloadId": "database.sqlite-notebook.v1",
  "implementationId": "database.sqlite-notebook.controlled.v1",
  "status": "static-validation-package",
  "sourceCommit": "ef8ea1e4021bad15384a350aba1b76d0ca540f91",
  "sourceTreeSha256": "ea9bbcbdb34aeff3358e9845d98acbe932799cde5c54840c1d943ae1db91a08d",
  "buildManifest": "public/artifacts/sqlite-notebook/build-manifest.json",
  "fixtureManifest": "public/artifacts/sqlite-notebook/fixtures/fixture-manifest.json",
  "reference": "public/artifacts/sqlite-notebook/reference.json",
  "completeOutputSha256": "fae41d80865456365118c98ee8dd74a502fb359ace69878190edca22e4f6572d",
  "correctness": {
    "queryCount": 8,
    "resultRows": 744,
    "allCellsMatched": true,
    "independentReferenceMatched": true
  },
  "performanceResult": null,
  "browserEvidence": "not-collected",
  "recordId": "database-sqlite-notebook-v1-javascript-controlled",
  "variant": "javascript-controlled",
  "target": "javascript",
  "counters": {
    "imports": 3,
    "importedRows": 4192,
    "queries": 8,
    "scans": 14,
    "joins": 6,
    "groups": 6,
    "windows": 2,
    "sorts": 8,
    "allocations": 11,
    "boundaryCrossings": 0
  }
}
